{
  "outcome_id": "WONG-QIU-2026-ORIGINALITY-TASK2-UNRESTRICTED",
  "source": {
    "citation": "Wong & Qiu (2026)",
    "doi": "10.1007/s10648-026-10118-7",
    "url": "https://doi.org/10.1007/s10648-026-10118-7"
  },
  "construct_interpretation": "Expert-rated originality of the submitted vocabulary-game product; task-specific score, not general creativity or durable learning.",
  "A": {
    "status": "removed",
    "detail": "Construct-relevant ChatGPT was unavailable during Task 2.",
    "source_evidence": "Published procedure and participant-level study documentation."
  },
  "D": {
    "category": "immediate",
    "detail": "Same-session subsequent task after an intervening questionnaire; exact elapsed time since final AI use not reported.",
    "source_evidence": "Published experimental procedure."
  },
  "O": {
    "status": "novel",
    "detail": "Task 2 used a different product-invention task rather than repeating Task 1.",
    "source_evidence": "Published task descriptions."
  },
  "G": {
    "status": "unclear",
    "detail": "Different product and task demands; a calibrated near/far transfer distance or common latent scale is not established.",
    "source_evidence": "Published descriptions: stuffed-bunny improvement and vocabulary-game invention."
  },
  "N": {
    "status": "prevented",
    "scope": "Source-reported absence of access to the study-provided ChatGPT interface and supplied prompts in Task 2.",
    "detail": "Protocol-based prevention is reported; an independent non-use audit, device-wide restriction log, or verification of every possible AI channel is not reported in the inspected procedure.",
    "source_evidence": "Published Procedure, Post-Intervention Stage states the task was completed without access to ChatGPT or the supplied prompts."
  },
  "notes": "Worked author coding, not independently validated. A=removed records the reported condition; N=prevented records source-reported protocol control, not independently verified non-use. Transfer distance remains unclear."
}
